{
  "generatedAt": "2026-01-21T20:43:34.392Z",
  "model": "local-composer",
  "backendLabel": "Local Narrative Composer",
  "sampleCount": 9,
  "samples": [
    {
      "id": "single-new-role",
      "spreadKey": "single",
      "spreadName": "One-Card Insight",
      "userQuestion": "What guiding energy should I bring into this new leadership role?",
      "reflectionsText": "I want to stay curious yet grounded even when the stakes feel high.",
      "context": "decision",
      "cardsInfo": [
        {
          "position": "Theme / Guidance of the Moment",
          "card": "The Fool",
          "orientation": "Upright",
          "meaning": "New beginnings, innocence, spontaneity, free spirit",
          "number": 0,
          "suit": null,
          "rank": null,
          "rankValue": null
        }
      ],
      "deckStyle": "rws-1909",
      "reading": "**One-Card Insight**\n\nYou're ready to explore what wants attention.\n\nTheme / Guidance of the Moment: This card shows: The Fool Upright. This shows new beginnings, innocence, spontaneity, free spirit as a live theme. For this decision, let this archetype illuminate the deeper currents shaping your choice. Notice the Fool's gaze toward the horizon—an invitation to step forward into the unknown with trust. *Archetype: Divine Fool / Innocent Wanderer. Key symbols: sun (enlightenment, new beginnings), dog (loyalty, instinct, warning), cliff (risk, the unknown, leap of faith).* This distills the essence of what wants your awareness.\n\nIn simple terms: notice what this theme is asking you to acknowledge (WHAT), reflect on why it might be surfacing now (WHY), and choose one small, aligned next step that honors your agency (WHAT'S NEXT). Therefore, treat this insight as a living moment, not a fixed verdict—a trajectory you actively shape.\n\n### Your Reflections\n\nThis reflection shows how this reading lands in your lived experience.\n\nI want to stay curious yet grounded even when the stakes feel high.\n\nYour intuitive impressions are valid and add personal meaning to this reading.\n\n**The Pivot:** The Fool in Theme / Guidance of the Moment. This card sits at a point of leverage in your spread.\n**Recurring Themes:**\n- Strong Air energy emphasizes thoughts, communication, and clarity.\n- High Major Arcana presence suggests significant life themes at play, not just day-to-day concerns.\n- All cards upright suggests energy is flowing without major blockages.\n\n**Emotional Journey:** The emotional tone remains relatively steady, centered around openness.\n\n**Guidance:** Hold the complexity without rushing to simplify.\n\n*Remember: these cards illuminate, they don't determine. Your choices shape what unfolds.*\n\n*Reversal lens reminder: Within the All Upright lens, Read each card's traditional upright meaning in the context of its position.*",
      "themesSummary": {
        "reversalFramework": "none",
        "suitFocus": null,
        "archetypeDescription": "High Major Arcana presence indicates profound, soul-level themes, karmic patterns, and significant life transitions."
      }
    },
    {
      "id": "three-card-transition",
      "spreadKey": "threeCard",
      "spreadName": "Three-Card Story (Past · Present · Future)",
      "userQuestion": "How can I navigate the transition after leaving my hometown?",
      "reflectionsText": "Part of me is nostalgic while another part is ready for reinvention.",
      "context": "general",
      "cardsInfo": [
        {
          "position": "Past — influences that led here",
          "card": "Six of Cups",
          "orientation": "Reversed",
          "meaning": "Living in the past, rose-colored views, difficulty moving on",
          "suit": "Cups",
          "rank": "Six",
          "rankValue": 6
        },
        {
          "position": "Present — where you stand now",
          "card": "The Tower",
          "orientation": "Upright",
          "meaning": "Sudden change, upheaval, chaos, revelation, awakening",
          "number": 16,
          "suit": null,
          "rank": null,
          "rankValue": null
        },
        {
          "position": "Future — trajectory if nothing shifts",
          "card": "The Star",
          "orientation": "Upright",
          "meaning": "Hope, faith, purpose, renewal, spirituality",
          "number": 17,
          "suit": null,
          "rank": null,
          "rankValue": null
        }
      ],
      "deckStyle": "rws-1909",
      "reading": "**Three-Card Story (Past · Present · Future)**\n\nYou're ready to explore what wants attention.\n\n*A pattern of necessary change that clears space for something new.*\n\n### Your Story\n\nPast — influences that led here: Looking back, Six of Cups Reversed traces the threads that shaped the current landscape. This shows living in the past, rose-colored views, difficulty moving on as a live theme. On a symbolic level, some readers link this card to Sun in Scorpio, reviving soulful loyalty, memory, and devotion; treat that as color, not a command. As a Cups card, this speaks to water, emotions, relationships, intuition, and how you give and receive care. At this rank, it marks recognition, victory, and public acknowledgment. Picture Child offers a flower-filled cup to another within a sunlit courtyard—this subtly colors how this suit's lesson shows up here. *Archetype: Water Restoration. Key symbols: six engraved cups (reciprocity, healing, generosity), giver and receiver figures (support in motion), lush riverbanks with lotus and reflective pools (peace returning after imbalance).* Noticing this helps you decide what you’re done carrying and what still serves.\n\nNow, at the heart of it— Present — where you stand now: In this moment, The Tower Upright captures the tone of your experience. This shows sudden change, upheaval, chaos, revelation, awakening as a live theme. On a symbolic level, some readers link this card to Mars, igniting sudden change, liberation, and necessary disruption; treat that as color, not a command.  On a symbolic level, some readers link this card to Mars, igniting sudden change, liberation, and necessary disruption and Path Peh (Netzach ↔ Hod), breaking open stale structures to free vitality; treat that as color, not a command. Notice the Tower's lightning—sudden upheaval shatters false structures, clearing space for truth. *Archetype: Sudden Upheaval / Ego Destroyer. Key symbols: lightning (sudden revelation, destruction), tower (false structures, ego), falling figures (release, downfall).* Treat it as a snapshot, not a sentence—a view of what’s here so you can choose how to meet it. Water and flame struggle for dominance; integration requires honoring both emotional depth and passionate drive.\n\nAnd yet, light breaks through as— Future — trajectory if nothing shifts: Looking ahead, The Star Upright outlines a likely path of momentum. If things continue as they are, this shows how the trajectory leans toward hope, faith, purpose, renewal, spirituality. On a symbolic level, some readers link this card to Aquarius, channeling vision, hope, and communal renewal; treat that as color, not a command.  On a symbolic level, some readers link this card to Aquarius, channeling vision, hope, and communal renewal and Path Tzaddi (Netzach ↔ Yesod), catching starlight inspirations for embodied hope; treat that as color, not a command. Picture the Star's flowing water—hope replenishes when you pour yourself into purpose and trust. *Archetype: Hope Bringer / Healer. Key symbols: large star (hope, guidance), seven smaller stars (chakras, inspiration), naked figure (vulnerability, authenticity).* Hold it as a forecast of trajectory, adjustable through your choices. Picture a spark fanned into flame—this illustrates how these energies amplify each other's potential.\n\nThe story unfolds from Six of Cups through The Tower to The Star. The move from first to second involves friction that shapes the narrative. The path forward from second to third is well-supported.\n\n### Your Reflections\n\nThis reflection shows how this reading lands in your lived experience.\n\nPart of me is nostalgic while another part is ready for reinvention.\n\nYour intuitive impressions are valid and add personal meaning to this reading.\n\n**The Overall Shape:** A pattern of necessary change that clears space for something new\n**The Pivot:** The Tower in Present — where you stand now. The Present is your point of power—where awareness becomes choice.\n**Recurring Themes:**\n- High Major Arcana presence suggests significant life themes at play, not just day-to-day concerns.\n\n**Emotional Journey:** This reading moves from openness toward joy—an upward emotional trajectory.\n\n**Guidance:** What falls away makes room for what's trying to emerge.\n\n*Remember: these cards illuminate, they don't determine. Your choices shape what unfolds.*\n\n### Moving Forward\n\nPace: Expect this to unfold across a meaningful chapter rather than in a single moment.\n\nThe path ahead shows The Star Upright. This is not fixed fate, but the trajectory of current momentum. Your awareness and choices shape what comes next. The Future position carries a weight of 0.90, so its voice leads the guidance.\n\nAltogether, these threads suggest your next supportive step and point toward how to walk this path with agency.\n\nFor you this reads as a honest acknowledgment, inviting energy in motion.\n\n*Reversal lens reminder: Within the Context-Dependent lens, Read each reversal according to what makes most sense for that specific card and position.*",
      "themesSummary": {
        "reversalFramework": "contextual",
        "suitFocus": null,
        "archetypeDescription": "High Major Arcana presence indicates profound, soul-level themes, karmic patterns, and significant life transitions."
      }
    },
    {
      "id": "five-card-creative-project",
      "spreadKey": "fiveCard",
      "spreadName": "Five-Card Clarity",
      "userQuestion": "What should I know about launching my creative project this quarter?",
      "reflectionsText": "I feel momentum but keep second-guessing the tone and timing.",
      "context": "decision",
      "cardsInfo": [
        {
          "position": "Core of the matter",
          "card": "Ace of Wands",
          "orientation": "Upright",
          "meaning": "Inspiration, new energy, creative spark, potential for bold action",
          "suit": "Wands",
          "rank": "Ace",
          "rankValue": 1
        },
        {
          "position": "Challenge or tension",
          "card": "Seven of Swords",
          "orientation": "Reversed",
          "meaning": "Exposure, consequences, call for transparency and integrity",
          "suit": "Swords",
          "rank": "Seven",
          "rankValue": 7
        },
        {
          "position": "Hidden / subconscious influence",
          "card": "Queen of Cups",
          "orientation": "Upright",
          "meaning": "Compassion, empathy, emotional intelligence, intuition in flow",
          "suit": "Cups",
          "rank": "Queen",
          "rankValue": 13
        },
        {
          "position": "Support / helpful energy",
          "card": "Three of Pentacles",
          "orientation": "Upright",
          "meaning": "Collaboration, skill development, building something of quality",
          "suit": "Pentacles",
          "rank": "Three",
          "rankValue": 3
        },
        {
          "position": "Likely direction on current path",
          "card": "Wheel of Fortune",
          "orientation": "Reversed",
          "meaning": "Bad luck, resistance to change, breaking cycles",
          "number": 10,
          "suit": null,
          "rank": null,
          "rankValue": null
        }
      ],
      "deckStyle": "rws-1909",
      "reading": "**Five-Card Clarity**\n\nYou come with curiosity and openness.\n\n### Five-Card Clarity — Core & Challenge\n\nCore of the matter: At the core of the matter: Ace of Wands Upright. This shows inspiration, new energy, creative spark, potential for bold action as a live theme. For this decision, consider which path ignites your passion and aligns with your authentic drive. As a Wands card, this speaks to fire, initiative, creativity, desire, and the way you act on your will. At this rank, it marks a seed or new spark of this suit’s energy, raw potential and beginnings. Picture Hand emerging from a cloud presenting a sprouting wand above rolling hills and a distant castle—this subtly colors how this suit's lesson shows up here. *Archetype: Fire Seed. Key symbols: divine hand emerging from cloud with budding wooden wand (pure Fire potential entering the scene), crown or laurels hovering (gifted opportunity ready to be claimed), desert horizon with pyramids and cloudless sky (open landscape waiting for new action).* This is the central issue—the thread that, if tended to, shifts the whole pattern.\n\nBut now, a different energy emerges— Challenge or tension: The challenge or tension: Seven of Swords Reversed. The friction here shows how it centers on exposure, consequences, call for transparency and integrity. For this decision, apply clear analysis, weigh the facts, and cut through confusion. As a Swords card, this speaks to air, mind, truth, communication, and how you navigate tension or clarity. At this rank, it marks assessment, testing, deeper questions about direction and alignment. Picture Sneaking figure tiptoes from a camp carrying five swords, two left behind—this subtly colors how this suit's lesson shows up here. *Archetype: Air Assessment. Key symbols: seven razor-sharp swords (inventory of progress and strategy), standing figure evaluating (moment to reassess effort or boundaries), wind-swept plains with storm clouds and distant mountains (field of ongoing labor or opposition).* Naming this tension can make it more workable. Picture a spark fanned into flame—this illustrates how these energies amplify each other's potential.\n\n\n\nFire and Air work harmoniously together, each supporting the other's expression. Because Ace of Wands supports and harmonizes with Seven of Swords, these energies flow together constructively.\n\n### Hidden Influence\n\nYet beneath the surface, quietly, Hidden / subconscious influence: In the unseen layers, Queen of Cups Upright signals stories or needs that aren’t fully voiced. This reveals how, beneath awareness, part of you is still relating to compassion, empathy, emotional intelligence, intuition in flow. For this decision, tune into your emotional truth and what your heart genuinely desires. As a Cups card, this speaks to water, emotions, relationships, intuition, and how you give and receive care. As a Queen, it highlights mature, receptive mastery of this suit—embodied wisdom, emotional intelligence, stewardship from within. Picture Throne by the sea, ornate covered cup held with devotion—this subtly colors how this suit's lesson shows up here. *Archetype: Water Sovereign. Key symbols: queen enthroned with ornate chalice overflowing with water (mature mastery with receptive influence), fauna, familiars, or motifs (embodied wisdom of the suit), lush riverbanks with lotus and reflective pools (domain nurtured through emotional intelligence).* This reveals influences beneath awareness—unspoken fears, hopes, or loyalties.\n\n### Supporting Energies\n\nMeanwhile, alongside the challenge, Support / helpful energy: Support and helpful energy come through: Three of Pentacles Upright. This shows collaboration, skill development, building something of quality as a live theme. For this decision, consider practical outcomes, resources, and long-term stability. As a Pentacles card, this speaks to earth, body, work, resources, and the material structures that support you. At this rank, it marks growth, first stability, collaboration, and visible development. Picture Craftsman discusses cathedral plans with monk and noble as pentacles decorate the arch—this subtly colors how this suit's lesson shows up here. *Archetype: Earth Expansion Arc. Key symbols: three garden pentacles (growth through cooperation and foresight), figure observing horizon or architecture (vision expanding outward), verdant fields, vineyards, and stone gateways (opportunities launching beyond comfort zone).* Let this remind you that you are not moving through this empty-handed.\n\n### Direction on Your Current Path\n\nTherefore, Likely direction on current path: On this current path, Wheel of Fortune Reversed sketches a probable trajectory. If things continue as they are, this shows how the trajectory leans toward bad luck, resistance to change, breaking cycles. For this decision, this reminds you that timing and external factors play a role—read the currents before acting. The Wheel resists its turn; clinging to the current phase delays inevitable transformation. *Archetype: Cycle Turner / Fate Weaver. Key symbols: wheel (cycles, change), sphinx (riddles, mystery), snake (transformation, descent).* This is not fixed fate—only the path of current momentum.\n\nThe core matter (Ace of Wands) faces the challenge of Seven of Swords. Support comes through Three of Pentacles, pointing toward Wheel of Fortune as the likely direction.\n\n### Your Reflections\n\nThis reflection shows how this reading lands in your lived experience.\n\nI feel momentum but keep second-guessing the tone and timing.\n\nYour intuitive impressions are valid and add personal meaning to this reading.\n\n**The Pivot:** Ace of Wands in Core of the matter. The Core reveals what everything else revolves around.\n**Recurring Themes:**\n- Strong Fire energy emphasizes passion, initiative, and creative energy.\n\n**Emotional Journey:** This reading moves from joy into uncertainty—prepare for and work with what's coming.\n\n**Guidance:** Hold the complexity without rushing to simplify.\n\n*Remember: these cards illuminate, they don't determine. Your choices shape what unfolds.*\n\n### Guidance\n\nThe path ahead shows Wheel of Fortune Reversed. This is not fixed fate, but where current momentum leads if nothing shifts. Your awareness and choices shape what unfolds next.\n\nFor you this becomes a honest acknowledgment, translating energy into practice.\n\n*Reversal lens reminder: Within the Mirror / Reflection lens, Ask what aspect of this energy you might be unconsciously expressing, attracting, or projecting onto others.*",
      "themesSummary": {
        "reversalFramework": "mirror",
        "suitFocus": null,
        "archetypeDescription": "Primarily Minor Arcana, focusing on practical, day-to-day dynamics and immediate concerns."
      }
    },
    {
      "id": "relationship-checkin",
      "spreadKey": "relationship",
      "spreadName": "Relationship Snapshot",
      "userQuestion": "What should I understand about the energetic exchange between me and Alex?",
      "reflectionsText": "Communication feels uneven lately and I want to ground before reacting.",
      "context": "decision",
      "cardsInfo": [
        {
          "position": "You / your energy",
          "card": "Queen of Cups",
          "orientation": "Reversed",
          "meaning": "Emotional overwhelm, martyrdom, blurred boundaries",
          "suit": "Cups",
          "rank": "Queen",
          "rankValue": 13
        },
        {
          "position": "Them / their energy",
          "card": "Knight of Swords",
          "orientation": "Upright",
          "meaning": "Decisive action, sharp focus, pursuing truth swiftly",
          "suit": "Swords",
          "rank": "Knight",
          "rankValue": 12
        },
        {
          "position": "The connection / shared lesson",
          "card": "Two of Cups",
          "orientation": "Upright",
          "meaning": "Connection, partnership, mutual respect, heartfelt unity",
          "suit": "Cups",
          "rank": "Two",
          "rankValue": 2
        }
      ],
      "deckStyle": "rws-1909",
      "reading": "**Relationship Snapshot**\n\nYou stand at a crossroads, weighing your options.\n\n### You and Them\n\nYou / your energy: Here, Queen of Cups Reversed mirrors your stance, needs, or patterns. This shows emotional overwhelm, martyrdom, blurred boundaries as a live theme. For this decision, tune into your emotional truth and what your heart genuinely desires. As a Cups card, this speaks to water, emotions, relationships, intuition, and how you give and receive care. As a Queen, it highlights mature, receptive mastery of this suit—embodied wisdom, emotional intelligence, stewardship from within. Picture Throne by the sea, ornate covered cup held with devotion—this subtly colors how this suit's lesson shows up here. *Archetype: Water Sovereign. Key symbols: queen enthroned with ornate chalice overflowing with water (mature mastery with receptive influence), fauna, familiars, or motifs (embodied wisdom of the suit), lush riverbanks with lotus and reflective pools (domain nurtured through emotional intelligence).* Use it to notice how you participate, without blaming yourself.\n\n*Reversal lens reminder: Within the Context-Dependent lens, Read each reversal according to what makes most sense for that specific card and position. For Queen of Cups, focus on where emotional overwhelm, martyrdom, blurred boundaries needs gentle attention before momentum can return.*\n\nBut now movement beckons with— Them / their energy: Knight of Swords Upright reflects how they’re currently arriving in this connection. This shows decisive action, sharp focus, pursuing truth swiftly as a live theme. For this decision, apply clear analysis, weigh the facts, and cut through confusion. As a Swords card, this speaks to air, mind, truth, communication, and how you navigate tension or clarity. As a Knight, it highlights movement and pursuit in this suit—how you or another actively chase, defend, or embody this energy. Picture Rider charging forward with sword raised, trees bent by wind—this subtly colors how this suit's lesson shows up here. *Archetype: Air Quest. Key symbols: knight on steed with steel sword with gleaming edge (pursuit, activism, mission), steed posture (rearing, pacing, still) (style of momentum specific to suit), wind-swept plains with storm clouds and distant mountains (conditions the quest must cross).* Treat it as information about the dynamic—not a verdict on their character.\n\n*Elemental interplay between you: Water and Air operate independently, neither reinforcing nor opposing each other.* Stay curious about how each of you is showing up today and keep checking in so the energy stays responsive, not reactive. Queen of Cups and Knight of Swords work together with subtle complexity.\n\n### The Connection\n\nThis position shows what the bond is asking for right now.\n\nNow, at the heart of it— The connection / shared lesson: Two of Cups Upright gives language to what this bond is asking of you both. This shows connection, partnership, mutual respect, heartfelt unity as a live theme. For this decision, tune into your emotional truth and what your heart genuinely desires. As a Cups card, this speaks to water, emotions, relationships, intuition, and how you give and receive care. At this rank, it marks duality, choices, early tension or balance within this suit’s themes. Picture Two figures exchange cups beneath a caduceus and lion-headed emblem—this subtly colors how this suit's lesson shows up here. *Archetype: Water Duality Gate. Key symbols: two engraved cups (decision, contrast, or mirrored forces), crossed arms or stance (moment of weighing possibilities), lush riverbanks with lotus and reflective pools (context that demands balanced planning).* This card speaks to the shared lesson, patterns, and potentials alive between you.\n\nThis focus invites you to notice what this bond is asking from both of you next.\n\n### Guidance for This Connection\n\nThis guidance shows how to participate with agency, honesty, and care.\n\nTherefore, The connection / shared lesson: Here, Two of Cups Upright frames the relationship as its own living entity. This shows connection, partnership, mutual respect, heartfelt unity as a live theme. For this decision, tune into your emotional truth and what your heart genuinely desires. As a Cups card, this speaks to water, emotions, relationships, intuition, and how you give and receive care. At this rank, it marks duality, choices, early tension or balance within this suit’s themes. Picture Two figures exchange cups beneath a caduceus and lion-headed emblem—this subtly colors how this suit's lesson shows up here. *Archetype: Water Duality Gate. Key symbols: two engraved cups (decision, contrast, or mirrored forces), crossed arms or stance (moment of weighing possibilities), lush riverbanks with lotus and reflective pools (context that demands balanced planning).* Let it name what this connection is teaching, without overstating what must happen next.\n\nWithin the Context-Dependent lens, Queen of Cups reversed asks you to notice where emotional overwhelm, martyrdom, blurred boundaries feels blocked and to agree on one practical step that eases the pressure. Knight of Swords invites you to practice decisive action, sharp focus, pursuing truth swiftly together—pick one specific action or conversation that expresses it this week. Two of Cups invites you to practice connection, partnership, mutual respect, heartfelt unity together—pick one specific action or conversation that expresses it this week.\n\nEmphasize honest communication, reciprocal care, and boundaries. Treat these insights as a mirror that informs how you choose to show up—not as a command to stay or leave. Choose the path that best honors honesty, care, and your own boundaries—the outcome still rests in the choices you both make.\n\nFor you this is a honest acknowledgment, inviting energy-level dialogue about how you both want to participate.\n\n### Your Reflections\n\nThis reflection shows how this reading lands in your lived experience.\n\nCommunication feels uneven lately and I want to ground before reacting.\n\nYour intuitive impressions are valid and add personal meaning to this reading.\n\nYou asked about a choice. The cards illuminate what each path asks of you, not which is \"right.\"\n**The Pivot:** Two of Cups in The connection / shared lesson. The Connection shows what the relationship itself is asking for.\n**Recurring Themes:**\n- Strong Water energy emphasizes emotions, intuition, and relationships.\n- 2 Cups cards indicate emotional matters, relationships, intuition, and heart-centered concerns are central to this reading.\n- Multiple court cards suggest other people or aspects of yourself are actively involved in this situation.\n\n**Emotional Journey:** The emotional tone remains relatively steady, centered around uncertainty.\n\n**Guidance:** Hold the complexity without rushing to simplify.\n\n*Remember: these cards illuminate, they don't determine. Your choices shape what unfolds.*\n\n### Supporting Your Connection\n\nWater energy strongly dominates (2/3 cards), requiring attention to balance with other elements.\n\nTo bring in underrepresented energies:\n- Fire: Move your body—take a walk, stretch, or dance to music\n- Earth: Establish one grounding daily ritual (morning tea, evening walk, bedtime routine)\n\nThese practices can help each of you show up more fully, bringing balance to the energies present in this reading. Consider what this trajectory invites you to do next.",
      "themesSummary": {
        "reversalFramework": "contextual",
        "suitFocus": "2 Cups cards indicate emotional matters, relationships, intuition, and heart-centered concerns are central to this reading.",
        "archetypeDescription": "Primarily Minor Arcana, focusing on practical, day-to-day dynamics and immediate concerns."
      }
    },
    {
      "id": "celtic-deep-shift",
      "spreadKey": "celtic",
      "spreadName": "Celtic Cross (Classic 10-Card)",
      "userQuestion": "How can I stay centered while everything at home and work restructures at once?",
      "reflectionsText": "It feels like multiple towers at the same time; I want to stay compassionate without losing momentum.",
      "context": "wellbeing",
      "cardsInfo": [
        {
          "position": "Present — core situation",
          "card": "The Hermit",
          "orientation": "Upright",
          "meaning": "Soul-searching, introspection, inner guidance, solitude",
          "number": 9,
          "suit": null,
          "rank": null,
          "rankValue": null
        },
        {
          "position": "Challenge — crossing / tension",
          "card": "Five of Wands",
          "orientation": "Reversed",
          "meaning": "Avoidance of conflict, resentment, unproductive tension",
          "suit": "Wands",
          "rank": "Five",
          "rankValue": 5
        },
        {
          "position": "Past — what lies behind",
          "card": "Death",
          "orientation": "Upright",
          "meaning": "Endings, change, transformation, transition",
          "number": 13,
          "suit": null,
          "rank": null,
          "rankValue": null
        },
        {
          "position": "Near Future — what lies before",
          "card": "Temperance",
          "orientation": "Upright",
          "meaning": "Balance, moderation, patience, purpose",
          "number": 14,
          "suit": null,
          "rank": null,
          "rankValue": null
        },
        {
          "position": "Conscious — goals & focus",
          "card": "The Emperor",
          "orientation": "Upright",
          "meaning": "Authority, establishment, structure, father figure",
          "number": 4,
          "suit": null,
          "rank": null,
          "rankValue": null
        },
        {
          "position": "Subconscious — roots / hidden forces",
          "card": "The Moon",
          "orientation": "Reversed",
          "meaning": "Release of fear, repressed emotion, inner confusion",
          "number": 18,
          "suit": null,
          "rank": null,
          "rankValue": null
        },
        {
          "position": "Self / Advice — how to meet this",
          "card": "Strength",
          "orientation": "Upright",
          "meaning": "Strength, courage, persuasion, influence, compassion",
          "number": 8,
          "suit": null,
          "rank": null,
          "rankValue": null
        },
        {
          "position": "External Influences — people & environment",
          "card": "Eight of Pentacles",
          "orientation": "Upright",
          "meaning": "Mastery through practice, craftsmanship, dedicated work",
          "suit": "Pentacles",
          "rank": "Eight",
          "rankValue": 8
        },
        {
          "position": "Hopes & Fears — deepest wishes & worries",
          "card": "Nine of Swords",
          "orientation": "Reversed",
          "meaning": "Recovery from anxiety, gaining perspective, support arriving",
          "suit": "Swords",
          "rank": "Nine",
          "rankValue": 9
        },
        {
          "position": "Outcome — likely path if unchanged",
          "card": "The Sun",
          "orientation": "Upright",
          "meaning": "Positivity, fun, warmth, success, vitality",
          "number": 19,
          "suit": null,
          "rank": null,
          "rankValue": null
        }
      ],
      "deckStyle": "rws-1909",
      "reading": "**Celtic Cross (Classic 10-Card)**\n\nYou're open to what the cards reveal.\n\n*A pattern of necessary change that clears space for something new.*\n\n### At the Heart of This Moment\n\nPresent — core situation: At the heart of this moment stands The Hermit Upright. This shows soul-searching, introspection, inner guidance, solitude as a live theme. For your wellbeing, this supports taking sacred retreat time for self-care and inner restoration. Picture the Hermit's lantern piercing darkness—solitude illuminates what crowds obscure. *Archetype: Wise Seeker / Inner Guide. Key symbols: lantern (inner light, guidance), six-pointed star (wisdom, union of opposites), staff (support, journey).* It points to what feels most alive, charged, or pressing in your experience.\n\nChallenge — crossing / tension: Crossing this, the challenge manifests as Five of Wands Reversed. The friction here shows how it centers on avoidance of conflict, resentment, unproductive tension. For your wellbeing, this speaks to vital energy, movement, and activities that restore your spark. As a Wands card, this speaks to fire, initiative, creativity, desire, and the way you act on your will. At this rank, it marks conflict, disruption, tests that stress the pattern and demand adjustment. Picture Band of youths brandishing wands in spirited but chaotic competition—this subtly colors how this suit's lesson shows up here. *Archetype: Fire Stress Point. Key symbols: five flame-etched wands (conflict, scarcity, or testing ground), figures in turmoil or adversity (challenge demanding resilience), desert horizon with pyramids and cloudless sky (conditions that amplify the lesson).* This points to the friction, obstacle, or dynamic that asks for integration.\n\nThe Hermit represents where you stand, while Five of Wands crosses as the immediate obstacle. The Hermit and Five of Wands work together with subtle complexity.\n\n### How You Arrived Here\n\nPast — what lies behind: In the background, Death Upright colors how you arrived here. This shows endings, change, transformation, transition as a live theme. For your wellbeing, let this archetype reveal what your body and mind are calling for. Picture the sun rising behind Death—endings clear ground for what must be born next. *Archetype: Transformer / Cycle Ender. Key symbols: skeleton (transformation, ending), white horse (purity, forward movement), banner (rebirth, mysticism).* Noticing this past context helps you choose what to keep and what to release.\n\nBecause of this foundation, Present — core situation: At the heart of this moment stands The Hermit Upright. This shows soul-searching, introspection, inner guidance, solitude as a live theme. For your wellbeing, this supports taking sacred retreat time for self-care and inner restoration. Picture the Hermit's lantern piercing darkness—solitude illuminates what crowds obscure. *Archetype: Wise Seeker / Inner Guide. Key symbols: lantern (inner light, guidance), six-pointed star (wisdom, union of opposites), staff (support, journey).* Treat this as a snapshot of how things feel from the inside out. As rain nourishes soil, these energies combine to create fertile ground for growth and manifestation.\n\nTherefore, looking ahead, Near Future — what lies before: What lies ahead in the near future: Temperance Upright. If things continue as they are, this shows how the trajectory leans toward balance, moderation, patience, purpose. For your wellbeing, this emphasizes balance, moderation, and the integration of body, mind, and spirit. Notice Temperance's flowing water—balance is active mixing, not static division. *Archetype: Alchemical Balancer / Healer. Key symbols: angel (balance, moderation), cups (alchemical mixing), one foot in water (subconscious, emotion).* See this as the next visible step if nothing major shifts.\n\nDeath in the past has led to The Hermit in the present. The past supports and flows naturally into the present state. This is developing toward Temperance in the near future.\n\n### What Moves Beneath the Surface\n\nSubconscious — roots / hidden forces: Below the surface, The Moon Reversed stirs quietly. This reveals how, beneath awareness, part of you is still relating to release of fear, repressed emotion, inner confusion. For your wellbeing, let this archetype reveal what your body and mind are calling for. Illusions begin to thin; repressed emotions surface, bringing difficult clarity. *Archetype: Illusion Navigator / Subconscious Explorer. Key symbols: full moon with face (illusion, subconscious), two towers (boundaries, duality), dog and wolf (tame and wild instincts).* Understanding this layer helps you respond with more self-compassion.\n\nConscious — goals & focus: The Emperor Upright speaks to what you know you’re reaching for. This shows authority, establishment, structure, father figure as a live theme. For your wellbeing, let this archetype reveal what your body and mind are calling for. Note the Emperor's mountain throne—stability comes through structure, leadership through clarity. *Archetype: Divine Father / Structured Leader. Key symbols: ram heads (Aries, leadership, initiation), mountains (stability, challenges overcome), scepter (authority, control).* It shows where your focus naturally goes when you think about this situation.\n\nHidden beneath awareness: The Moon Reversed. Conscious goal or aspiration: The Emperor Upright. There is tension between what you want consciously and what drives you beneath awareness. Integration is needed.\n\n*This misalignment suggests inner work is needed to bring your depths and aspirations into harmony.*\n\n### The Path Forward\n\nSelf / Advice — how to meet this: Strength Upright offers a way you might show up for yourself here. This shows how it may help to lean into strength, courage, persuasion, influence, compassion. For your wellbeing, let this archetype reveal what your body and mind are calling for. See the gentle hand on the lion's jaw—true strength is compassionate persuasion, not domination. *Archetype: Compassionate Warrior / Inner Strength. Key symbols: lion (inner beast, passion, courage), infinity symbol (eternal strength, patience), flowers (gentleness, purity).* Take it as an invitation, not a command: notice what feels workable.\n\nExternal Influences — people & environment: Around you, Eight of Pentacles Upright reflects other people and conditions in play. This shows that around you, circumstances echo mastery through practice, craftsmanship, dedicated work. For your wellbeing, this recommends body care, nutrition, sleep, and grounding routines. As a Pentacles card, this speaks to earth, body, work, resources, and the material structures that support you. At this rank, it marks dedication, focused work, sustained effort in this suit’s domain. Picture Craftsman carves pentacles along a workbench with a town in the distance—this subtly colors how this suit's lesson shows up here. *Archetype: Earth Movement. Key symbols: eight garden pentacles (momentum, departure, or quick progress), figure in action or exiting scene (choice to move toward alignment), verdant fields, vineyards, and stone gateways (landscape stretching toward next phase).* Let this help you choose where to engage and where to release.\n\nHopes & Fears — deepest wishes & worries: Your hopes and fears intertwine in Nine of Swords Reversed. This reveals both longing and worry around recovery from anxiety, gaining perspective, support arriving. For your wellbeing, this highlights the weight of anxious thoughts and invites grounding practices and compassionate support. As a Swords card, this speaks to air, mind, truth, communication, and how you navigate tension or clarity. At this rank, it marks fruition, culmination near completion, self-sufficiency in this area. Picture Person bolts upright in bed with hands covering their face, nine swords etched on the wall—this subtly colors how this suit's lesson shows up here. *Archetype: Air Culmination. Key symbols: nine razor-sharp swords (fruits of labor, boundaries, refinement), solitary figure (self-possession, vigilance, or luxury), wind-swept plains with storm clouds and distant mountains (personal domain requiring upkeep).* It often names ambivalence—wanting something and fearing its cost at the same time.\n\nOutcome — likely path if unchanged: The likely outcome, if the current path continues: The Sun Upright. If things continue as they are, this shows how the trajectory leans toward positivity, fun, warmth, success, vitality. For your wellbeing, let this archetype reveal what your body and mind are calling for. Notice the child's unguarded joy on the Sun's horse—authenticity shines when pretense falls away. *Archetype: Joyful Illuminator / Vital Force. Key symbols: radiant sun with face (vitality, clarity), naked child (innocence, joy), sunflowers (happiness, growth).* This is a trajectory based on current patterns, not a fixed fate.\n\nThe advice (Strength) and outcome (The Sun) share the same Fire energy, creating a unified path forward.\n\n### How the Cards Speak to Each Other\n\nSeveral cards in this spread echo and respond to each other.\n\n**The Emperor** in Conscious Goal (Above) and **The Sun** in Outcome (Final) reinforce and intensify each other.\n\n**Strength** in Self/Advice and **The Sun** in Outcome reinforce and intensify each other.\n\n**Temperance** in Near Future and **The Sun** in Outcome reinforce and intensify each other.\n\n**The Moon** in Subconscious (Below) and **Nine of Swords** in Hopes & Fears each contribute their own voice to this reading.\n\nThese connections reveal how to translate the spread's wisdom into your next step.\n\n### Your Reflections\n\nThis reflection shows how this reading lands in your lived experience.\n\nIt feels like multiple towers at the same time; I want to stay compassionate without losing momentum.\n\nYour intuitive impressions are valid and add personal meaning to this reading.\n\n**The Overall Shape:** A pattern of necessary change that clears space for something new\n**The Pivot:** Strength in Self / Advice — how to meet this. The Advice position shows how to engage with everything else in the spread.\n**Recurring Themes:**\n- Strong Fire energy emphasizes passion, initiative, and creative energy.\n- High Major Arcana presence suggests significant life themes at play, not just day-to-day concerns.\n\n**Emotional Journey:** This reading moves from hope toward joy—an upward emotional trajectory.\n\n**Guidance:** What falls away makes room for what's trying to emerge.\n\n*Remember: these cards illuminate, they don't determine. Your choices shape what unfolds.*\n\n### Bringing It Together\n\nFocus: Interpreting this guidance through health, balance, and holistic wellness.\n\nHigh Major Arcana presence indicates profound, soul-level themes, karmic patterns, and significant life transitions.\n\nElemental context: Fire energy strongly dominates (5/10 cards), requiring attention to balance with other elements.\n\nTo bring in underrepresented energies:\n- Air: Learn something new that sparks your curiosity\n\nPace: This reads as an unfolding chapter that rewards consistent, conscious engagement.\n\n**Your next step**\nThis step shows where to focus your agency right now.\nSelf / Advice — how to meet this: Strength Upright offers a way you might show up for yourself here. This shows how it may help to lean into strength, courage, persuasion, influence, compassion. For your wellbeing, let this archetype reveal what your body and mind are calling for. See the gentle hand on the lion's jaw—true strength is compassionate persuasion, not domination. *Archetype: Compassionate Warrior / Inner Strength. Key symbols: lion (inner beast, passion, courage), infinity symbol (eternal strength, patience), flowers (gentleness, purity).* Take it as an invitation, not a command: notice what feels workable.\nThe advice (Strength) and outcome (The Sun) share the same Fire energy, creating a unified path forward.\n\n**Trajectory Reminder**\nOutcome — likely path if unchanged: The likely outcome, if the current path continues: The Sun Upright. If things continue as they are, this shows how the trajectory leans toward positivity, fun, warmth, success, vitality. For your wellbeing, let this archetype reveal what your body and mind are calling for. Notice the child's unguarded joy on the Sun's horse—authenticity shines when pretense falls away. *Archetype: Joyful Illuminator / Vital Force. Key symbols: radiant sun with face (vitality, clarity), naked child (innocence, joy), sunflowers (happiness, growth).* This is a trajectory based on current patterns, not a fixed fate.\nRemember: The outcome shown by The Sun is a trajectory based on current patterns. Your choices, consciousness, and actions shape what unfolds. You are co-creating this path.\n\n*Reversal lens reminder: Within the Delayed Timing lens, Read reversals as energies that will manifest later, after certain conditions are met.*",
      "themesSummary": {
        "reversalFramework": "delayed",
        "suitFocus": null,
        "archetypeDescription": "High Major Arcana presence indicates profound, soul-level themes, karmic patterns, and significant life transitions."
      }
    },
    {
      "id": "decision-crossroads-long-reflections",
      "spreadKey": "decision",
      "spreadName": "Decision / Two-Path",
      "userQuestion": "I am at a decision point about whether to relocate or stay. Which path supports my growth?",
      "reflectionsText": "I keep weighing stability against growth, and my mind loops between the two paths. I keep weighing stability against growth, and my mind loops between the two paths. I keep weighing stability against growth, and my mind loops between the two paths. I keep weighing stability against growth, and my mind loops between the two paths. I keep weighing stability against growth, and my mind loops between the two paths. I keep weighing stability against growth, and my mind loops between the two paths. I keep weighing stability against growth, and my mind loops between the two paths. I keep weighing stability against growth, and my mind loops between the two paths.",
      "context": "decision",
      "cardsInfo": [
        {
          "position": "Heart of the decision",
          "card": "The Lovers",
          "orientation": "Upright",
          "meaning": "Love, harmony, relationships, values alignment, choices",
          "number": 6,
          "suit": null,
          "rank": null,
          "rankValue": null
        },
        {
          "position": "Path A — energy & likely outcome",
          "card": "Two of Wands",
          "orientation": "Upright",
          "meaning": "Planning, looking ahead, making empowered choices, considering options",
          "suit": "Wands",
          "rank": "Two",
          "rankValue": 2
        },
        {
          "position": "Path B — energy & likely outcome",
          "card": "Six of Swords",
          "orientation": "Reversed",
          "meaning": "Difficulty leaving, emotional baggage, stalled transition",
          "suit": "Swords",
          "rank": "Six",
          "rankValue": 6
        },
        {
          "position": "What clarifies the best path",
          "card": "Justice",
          "orientation": "Upright",
          "meaning": "Justice, fairness, truth, cause and effect, law",
          "number": 11,
          "suit": null,
          "rank": null,
          "rankValue": null
        },
        {
          "position": "What to remember about your free will",
          "card": "The Fool",
          "orientation": "Reversed",
          "meaning": "Recklessness, taken advantage of, inconsideration",
          "number": 0,
          "suit": null,
          "rank": null,
          "rankValue": null
        }
      ],
      "deckStyle": "rws-1909",
      "reading": "**Decision / Two-Path**\n\nA choice calls for your attention.\n\n*A crossroads requiring discernment and commitment.*\n\n### The Choice\n\nHeart of the decision: At the heart of this decision: The Lovers Upright. This shows love, harmony, relationships, values alignment, choices as a live theme. For this decision, this emphasizes alignment with your deepest values—choose what resonates with who you truly are. Picture the angel's blessing above the Lovers—alignment of values creates sacred union. *Archetype: Sacred Union / Choice Maker. Key symbols: angel (divine blessing, higher guidance), tree of knowledge (choice, temptation), tree of life (passion, vitality).* Let it help you name the values and needs that deserve to lead.\n\nThis position stands at the center of your decision and points toward what truly matters as you weigh each path.\n\n### Path A\n\nBecause we are looking at one route, Path A — energy & likely outcome: If you lean into Path A, Two of Wands Upright sketches how this route may feel. This shows planning, looking ahead, making empowered choices, considering options as a live theme. For this decision, consider which path ignites your passion and aligns with your authentic drive. As a Wands card, this speaks to fire, initiative, creativity, desire, and the way you act on your will. At this rank, it marks duality, choices, early tension or balance within this suit’s themes. Picture Figure standing on castle battlements holding a globe with two wands anchoring the space—this subtly colors how this suit's lesson shows up here. *Archetype: Fire Duality Gate. Key symbols: two flame-etched wands (decision, contrast, or mirrored forces), crossed arms or stance (moment of weighing possibilities), desert horizon with pyramids and cloudless sky (context that demands balanced planning).* Hold it as one trajectory among many, shaped by your choices.\n\nThis path suggests one possible trajectory if you commit to this direction.\n\n### Path B\n\nHowever, alternatively, Path B — energy & likely outcome: Path B, its energy and likely outcome: Six of Swords Reversed. This shows difficulty leaving, emotional baggage, stalled transition as a live theme. For this decision, apply clear analysis, weigh the facts, and cut through confusion. As a Swords card, this speaks to air, mind, truth, communication, and how you navigate tension or clarity. At this rank, it marks recognition, victory, and public acknowledgment. Picture Boat ferries cloaked figures across calm water with swords standing in the bow—this subtly colors how this suit's lesson shows up here. *Archetype: Air Restoration. Key symbols: six razor-sharp swords (reciprocity, healing, generosity), giver and receiver figures (support in motion), wind-swept plains with storm clouds and distant mountains (peace returning after imbalance).* Compare it with Path A by how your body and ethics respond, not from fear.\n\nThis path suggests an alternate trajectory, inviting you to compare how each route aligns with your values.\n\n### Clarity + Agency\n\nAnd here, at the turning point— What clarifies the best path: What clarifies the best path forward: Justice Upright. This shows justice, fairness, truth, cause and effect, law as a live theme. For this decision, this calls for fair evaluation, weighing evidence carefully, and accepting the consequences of your choice. Notice Justice's balanced scales—truth seeks equilibrium, consequences align with actions. *Archetype: Balanced Arbiter / Truth Seeker. Key symbols: scales (balance, fairness), sword (truth, decision), pillars (stability, duality).* Use it as a clarifying lens, not as a command.\n\nComparing the two paths: Fire and Air work harmoniously together, each supporting the other's expression. Building on this insight— What to remember about your free will: This position, held by The Fool Reversed, is a reminder that no card overrides your consent or agency. This shows recklessness, taken advantage of, inconsideration as a live theme. For this decision, let this archetype illuminate the deeper currents shaping your choice. The figure hesitates at the precipice; the leap requires more preparation before the jump. *Archetype: Divine Fool / Innocent Wanderer. Key symbols: sun (enlightenment, new beginnings), dog (loyalty, instinct, warning), cliff (risk, the unknown, leap of faith).* This reminds you of your power to choose and re-choose as new information emerges.\n\nUse these insights to understand how each option feels in your body and life. The cards illuminate possibilities; you remain the one who chooses. Each route is a trajectory shaped by your next intentional steps.\n\n### Your Reflections\n\nThis reflection shows how this reading lands in your lived experience.\n\nI keep weighing stability against growth, and my mind loops between the two paths. I keep weighing stability against growth, and my mind loops between the two paths. I keep weighing stability against growth, and my mind loops between the two paths. I keep weighing stability against growth, and my mind loops between the two paths. I keep weighing stability against growth, and my mind loops between the two paths. I keep weighing stability against growth, and my mind loops between the two paths. I keep weighing stability against growth, and my mind loops between the two paths. I keep weighing stability against growth, and my mind loops between the two paths.\n\nYour intuitive impressions are valid and add personal meaning to this reading.\n\nYou asked about a choice. The cards illuminate what each path asks of you, not which is \"right.\"\n**The Overall Shape:** A crossroads requiring discernment and commitment\n**The Pivot:** Justice in What clarifies the best path. The Clarifier illuminates what your deeper wisdom already knows.\n**Recurring Themes:**\n- Strong Air energy emphasizes thoughts, communication, and clarity.\n- High Major Arcana presence suggests significant life themes at play, not just day-to-day concerns.\n\n**Emotional Journey:** This reading moves from joy into uncertainty—prepare for and work with what's coming.\n\n**Guidance:** Indecision has its own cost; trust yourself to choose.\n\n*Remember: these cards illuminate, they don't determine. Your choices shape what unfolds.*\n\n### Guidance\n\nAir energy strongly dominates (4/5 cards), requiring attention to balance with other elements.\n\nTo bring in underrepresented energies:\n- Water: Spend time near water or take a mindful bath\n- Earth: Organize a small physical space to create order\n\nRemember: a decision is not a single moment but a series of aligned actions. These cards show energies and tendencies, not fixed outcomes. Your choices, moment to moment, shape which path you actually walk.\n\nFor you this is a honest acknowledgment to notice which path carries more energy and agency.\n\n*Reversal lens reminder: Within the Delayed Timing lens, Read reversals as energies that will manifest later, after certain conditions are met.*",
      "themesSummary": {
        "reversalFramework": "delayed",
        "suitFocus": null,
        "archetypeDescription": "High Major Arcana presence indicates profound, soul-level themes, karmic patterns, and significant life transitions."
      }
    },
    {
      "id": "spiritual-thoth-ritual",
      "spreadKey": "threeCard",
      "spreadName": "Three-Card Story (Past · Present · Future)",
      "userQuestion": "What spiritual practice should I commit to this season to deepen my intuition?",
      "reflectionsText": "I want a ritual that feels grounded, not performative.",
      "context": "spiritual",
      "cardsInfo": [
        {
          "position": "Past — influences that led here",
          "card": "The Hierophant",
          "orientation": "Upright",
          "meaning": "Spiritual wisdom, tradition, conformity, institutions",
          "number": 5,
          "suit": null,
          "rank": null,
          "rankValue": null
        },
        {
          "position": "Present — where you stand now",
          "card": "The High Priestess",
          "orientation": "Reversed",
          "meaning": "Secrets, disconnected from intuition, withdrawal",
          "number": 2,
          "suit": null,
          "rank": null,
          "rankValue": null
        },
        {
          "position": "Future — trajectory if nothing shifts",
          "card": "The Star",
          "orientation": "Upright",
          "meaning": "Hope, faith, purpose, renewal, spirituality",
          "number": 17,
          "suit": null,
          "rank": null,
          "rankValue": null
        }
      ],
      "deckStyle": "thoth-a1",
      "reading": "**Three-Card Story (Past · Present · Future)**\n\nYou're ready to explore what wants attention.\n\n*A call to pause, reflect, and integrate before acting.*\n\n### Your Story\n\nPast — influences that led here: The past, showing what has led to this moment: The Hierophant Upright. This shows spiritual wisdom, tradition, conformity, institutions as a live theme. In your spiritual path, let this archetype frame the lesson seeking integration. On a symbolic level, some readers link this card to Taurus, rooting guidance in steady devotion, embodiment, and values; treat that as color, not a command.  On a symbolic level, some readers link this card to Taurus, rooting guidance in steady devotion, embodiment, and values and Path Vav (Chokmah ↔ Chesed), extending divine impulse into benevolent structure; treat that as color, not a command. See the Hierophant's blessing hand—tradition and teaching offer a path, not a prison. *Archetype: Spiritual Guide / Traditional Wisdom. Key symbols: crossed keys (spiritual authority, access to knowledge), two acolytes (teaching, transmission of wisdom), raised hand (blessing, divine connection).* This represents the foundation, causes, and influences that set the stage for where you stand now.\n\nNow, at the heart of it— Present — where you stand now: Right now, The Priestess (RWS: The High Priestess) Reversed mirrors the live dynamics you’re moving through. This shows secrets, disconnected from intuition, withdrawal as a live theme. In your spiritual path, let this archetype frame the lesson seeking integration. On a symbolic level, some readers link this card to Moon (astrology), drawing you toward intuition, dreams, and liminal wisdom; treat that as color, not a command.  On a symbolic level, some readers link this card to Moon (astrology), drawing you toward intuition, dreams, and liminal wisdom and Path Gimel (Kether ↔ Tiphareth), carrying mystery from crown to the heart-center; treat that as color, not a command. The veil thickens; secrets remain hidden, requiring deeper stillness to penetrate. *Archetype: Mystic Guardian / Inner Knowing. Key symbols: pillars (duality, balance of opposites), lunar crown (cycles, intuition, feminine mystery), scroll (hidden knowledge, TORA (Torah/law)).* Treat it as a snapshot, not a sentence—a view of what’s here so you can choose how to meet it. Like riverbanks shaping the flow, these elements guide and contain each other constructively.\n\nWith this as the fulcrum— Future — trajectory if nothing shifts: If nothing major shifts, The Star Upright suggests where this might be heading. If things continue as they are, this shows how the trajectory leans toward hope, faith, purpose, renewal, spirituality. In your spiritual path, let this archetype frame the lesson seeking integration. On a symbolic level, some readers link this card to Aquarius, channeling vision, hope, and communal renewal; treat that as color, not a command.  On a symbolic level, some readers link this card to Aquarius, channeling vision, hope, and communal renewal and Path Tzaddi (Netzach ↔ Yesod), catching starlight inspirations for embodied hope; treat that as color, not a command. Picture the Star's flowing water—hope replenishes when you pour yourself into purpose and trust. *Archetype: Hope Bringer / Healer. Key symbols: large star (hope, guidance), seven smaller stars (chakras, inspiration), naked figure (vulnerability, authenticity).* Hold it as a forecast of trajectory, adjustable through your choices.\n\nThe story unfolds from The Hierophant through The High Priestess to The Star. The transition from first to second position is harmonious. \n\n### Your Reflections\n\nThis reflection shows how this reading lands in your lived experience.\n\nI want a ritual that feels grounded, not performative.\n\nYour intuitive impressions are valid and add personal meaning to this reading.\n\n**The Overall Shape:** A call to pause, reflect, and integrate before acting\n**The Pivot:** The High Priestess in Present — where you stand now. The Present is your point of power—where awareness becomes choice.\n**Recurring Themes:**\n- High Major Arcana presence suggests significant life themes at play, not just day-to-day concerns.\n\n**Emotional Journey:** This reading moves from uncertainty toward joy—an upward emotional trajectory.\n\n**Guidance:** The answers you seek are within; create space to listen.\n\n*Remember: these cards illuminate, they don't determine. Your choices shape what unfolds.*\n\n### Moving Forward\n\nFocus: Interpreting the path ahead through spiritual practice and meaning-making.\n\nPace: Expect this to unfold across a meaningful chapter rather than in a single moment.\n\nThe path ahead shows The Star Upright. This is not fixed fate, but the trajectory of current momentum. Your awareness and choices shape what comes next. The Future position carries a weight of 0.90, so its voice leads the guidance.\n\nAltogether, these threads suggest your next supportive step and point toward how to walk this path with agency.\n\nFor you this reads as a honest acknowledgment, inviting energy in motion.\n\n*Reversal lens reminder: Within the Context-Dependent lens, Read each reversal according to what makes most sense for that specific card and position.*",
      "themesSummary": {
        "reversalFramework": "contextual",
        "suitFocus": null,
        "archetypeDescription": "High Major Arcana presence indicates profound, soul-level themes, karmic patterns, and significant life transitions."
      }
    },
    {
      "id": "wellbeing-marseille-reset",
      "spreadKey": "fiveCard",
      "spreadName": "Five-Card Clarity",
      "userQuestion": "I am feeling burnout and restless sleep. What helps me restore my wellbeing?",
      "reflectionsText": "My body feels tired even when my mind is racing.",
      "context": "wellbeing",
      "cardsInfo": [
        {
          "position": "Core of the matter",
          "card": "Four of Swords",
          "orientation": "Upright",
          "meaning": "Rest, retreat, mental recovery, intentional pause",
          "suit": "Swords",
          "rank": "Four",
          "rankValue": 4
        },
        {
          "position": "Challenge or tension",
          "card": "Ten of Wands",
          "orientation": "Reversed",
          "meaning": "Overload, unsustainable pressure, needing to delegate or release",
          "suit": "Wands",
          "rank": "Ten",
          "rankValue": 10
        },
        {
          "position": "Hidden / subconscious influence",
          "card": "Temperance",
          "orientation": "Upright",
          "meaning": "Balance, moderation, patience, purpose",
          "number": 14,
          "suit": null,
          "rank": null,
          "rankValue": null
        },
        {
          "position": "Support / helpful energy",
          "card": "Six of Pentacles",
          "orientation": "Upright",
          "meaning": "Generosity, reciprocity, fair exchange, support in balance",
          "suit": "Pentacles",
          "rank": "Six",
          "rankValue": 6
        },
        {
          "position": "Likely direction on current path",
          "card": "The Sun",
          "orientation": "Reversed",
          "meaning": "Inner child, feeling down, overly optimistic",
          "number": 19,
          "suit": null,
          "rank": null,
          "rankValue": null
        }
      ],
      "deckStyle": "marseille-classic",
      "reading": "**Five-Card Clarity**\n\nYou're ready to explore what wants attention.\n\n### Five-Card Clarity — Core & Challenge\n\nCore of the matter: Here, Four of Epees (RWS: Four of Swords) (RWS: Four of Swords) Upright names the heart of what you’re really exploring. This shows rest, retreat, mental recovery, intentional pause as a live theme. For your wellbeing, this validates the need for rest and recovery—healing requires intentional pause. As a Swords card, this speaks to air, mind, truth, communication, and how you navigate tension or clarity. At this rank, it marks foundation, consolidation, stability that can comfort or confine. Picture Knight rests on a tomb within a chapel, swords hanging on the wall and one beneath—this subtly colors how this suit's lesson shows up here. *Marseille Pip 4: Structure—Quadrants built from intersecting batons or swords.* *Archetype: Air Foundation. Key symbols: four razor-sharp swords (structure, ritual, milestone), seated or standing figure (holding space, pausing to appreciate), wind-swept plains with storm clouds and distant mountains (sheltered stage for celebration or rest).* This is the central issue—the thread that, if tended to, shifts the whole pattern.\n\nWith this as the fulcrum— Challenge or tension: The challenge or tension: Ten of Batons (RWS: Ten of Wands) (RWS: Ten of Wands) Reversed. The friction here shows how it centers on overload, unsustainable pressure, needing to delegate or release. For your wellbeing, this speaks to vital energy, movement, and activities that restore your spark. As a Wands card, this speaks to fire, initiative, creativity, desire, and the way you act on your will. At this rank, it marks peak expression, legacy, long-term consequence of the suit’s journey. Picture Figure hunched beneath the weight of ten bundled wands trudging toward town—this subtly colors how this suit's lesson shows up here. *Marseille Pip 10: Threshold—Four pairs framing a central staff or sword, indicating closure.* *Archetype: Fire Completion. Key symbols: ten flame-etched wands (culmination, saturation, or heavy load), family/figures interacting (transfer of lessons across generations), desert horizon with pyramids and cloudless sky (world built by sustained effort).* Naming this tension can make it more workable. Like wind feeding flame, these forces work together to accelerate momentum and spread influence.\n\n\n\nAir and Fire work harmoniously together, each supporting the other's expression.\n\n### Hidden Influence\n\nYet beneath the surface, quietly, Hidden / subconscious influence: Hidden from view, the subconscious influence: Temperance Upright. This reveals how, beneath awareness, part of you is still relating to balance, moderation, patience, purpose. For your wellbeing, this emphasizes balance, moderation, and the integration of body, mind, and spirit. Notice Temperance's flowing water—balance is active mixing, not static division. *Archetype: Alchemical Balancer / Healer. Key symbols: angel (balance, moderation), cups (alchemical mixing), one foot in water (subconscious, emotion).* This reveals influences beneath awareness—unspoken fears, hopes, or loyalties.\n\n### Supporting Energies\n\nMeanwhile, alongside the challenge, Support / helpful energy: Six of Coins (RWS: Six of Pentacles) (RWS: Six of Pentacles) Upright highlights resources, allies, or inner strengths available now. This shows generosity, reciprocity, fair exchange, support in balance as a live theme. For your wellbeing, this recommends body care, nutrition, sleep, and grounding routines. As a Pentacles card, this speaks to earth, body, work, resources, and the material structures that support you. At this rank, it marks recognition, victory, and public acknowledgment. Picture Merchant balances scales while giving coins to two kneeling figures—this subtly colors how this suit's lesson shows up here. *Marseille Pip 6: Harmony—Hexagonal arrangement framing a radiant center.* *Archetype: Earth Restoration. Key symbols: six garden pentacles (reciprocity, healing, generosity), giver and receiver figures (support in motion), verdant fields, vineyards, and stone gateways (peace returning after imbalance).* This is what you can lean on as you navigate the situation.\n\n### Direction on Your Current Path\n\nTherefore, Likely direction on current path: If patterns hold, Le Soleil (RWS: The Sun) (RWS: The Sun) Reversed hints at where things may be heading. If things continue as they are, this shows how the trajectory leans toward inner child, feeling down, overly optimistic. For your wellbeing, let this archetype reveal what your body and mind are calling for. The light feels too bright or not quite reaching; reconnect with simple pleasures to restore vitality. *Archetype: Joyful Illuminator / Vital Force. Key symbols: radiant sun with face (vitality, clarity), naked child (innocence, joy), sunflowers (happiness, growth).* Use it as feedback about how your present choices echo forward.\n\nThe core matter (Four of Swords) faces the challenge of Ten of Wands. Support comes through Six of Pentacles, pointing toward The Sun as the likely direction.\n\n### Your Reflections\n\nThis reflection shows how this reading lands in your lived experience.\n\nMy body feels tired even when my mind is racing.\n\nYour intuitive impressions are valid and add personal meaning to this reading.\n\n**The Pivot:** Four of Swords in Core of the matter. The Core reveals what everything else revolves around.\n**Recurring Themes:**\n- Strong Fire energy emphasizes passion, initiative, and creative energy.\n\n**Emotional Journey:** The emotional tone remains relatively steady, centered around hope.\n\n**Guidance:** Hold the complexity without rushing to simplify.\n\n*Remember: these cards illuminate, they don't determine. Your choices shape what unfolds.*\n\n### Guidance\n\nFire energy strongly dominates (3/5 cards), requiring attention to balance with other elements.\n\nTo bring in underrepresented energies:\n- Water: Spend time near water or take a mindful bath\n\nThe path ahead shows The Sun Reversed. This is not fixed fate, but where current momentum leads if nothing shifts. Your awareness and choices shape what unfolds next.\n\nFor you this becomes a honest acknowledgment, translating energy into practice.\n\n*Reversal lens reminder: Within the Delayed Timing lens, Read reversals as energies that will manifest later, after certain conditions are met.*",
      "themesSummary": {
        "reversalFramework": "delayed",
        "suitFocus": null,
        "archetypeDescription": "Moderate Major Arcana suggests important archetypal lessons woven through everyday matters."
      }
    },
    {
      "id": "non-english-spanish",
      "spreadKey": "threeCard",
      "spreadName": "Three-Card Story (Past · Present · Future)",
      "userQuestion": "Como puedo sostener mi energia mientras apoyo a mi familia y mi trabajo?",
      "reflectionsText": "Quiero sentirme presente sin perder mi rumbo.",
      "context": "general",
      "cardsInfo": [
        {
          "position": "Past — influences that led here",
          "card": "The Hermit",
          "orientation": "Upright",
          "meaning": "Soul-searching, introspection, inner guidance, solitude",
          "number": 9,
          "suit": null,
          "rank": null,
          "rankValue": null
        },
        {
          "position": "Present — where you stand now",
          "card": "Eight of Cups",
          "orientation": "Upright",
          "meaning": "Walking away, deeper search, leaving what no longer nourishes",
          "suit": "Cups",
          "rank": "Eight",
          "rankValue": 8
        },
        {
          "position": "Future — trajectory if nothing shifts",
          "card": "The Sun",
          "orientation": "Reversed",
          "meaning": "Inner child, feeling down, overly optimistic",
          "number": 19,
          "suit": null,
          "rank": null,
          "rankValue": null
        }
      ],
      "deckStyle": "rws-1909",
      "reading": "**Three-Card Story (Past · Present · Future)**\n\nYou're open to what the cards reveal.\n\n*A call to pause, reflect, and integrate before acting.*\n\n### Your Story\n\nPast — influences that led here: Behind you, The Hermit Upright outlines the experiences that fed into this chapter. This shows soul-searching, introspection, inner guidance, solitude as a live theme. On a symbolic level, some readers link this card to Virgo, favoring discernment, service, and grounded reflection; treat that as color, not a command.  On a symbolic level, some readers link this card to Virgo, favoring discernment, service, and grounded reflection and Path Yod (Chesed ↔ Tiphareth), refining devotion through mindful service; treat that as color, not a command. Picture the Hermit's lantern piercing darkness—solitude illuminates what crowds obscure. *Archetype: Wise Seeker / Inner Guide. Key symbols: lantern (inner light, guidance), six-pointed star (wisdom, union of opposites), staff (support, journey).* This represents the foundation, causes, and influences that set the stage for where you stand now.\n\nNow, at the heart of it— Present — where you stand now: In this moment, Eight of Cups Upright captures the tone of your experience. This shows walking away, deeper search, leaving what no longer nourishes as a live theme. As a Cups card, this speaks to water, emotions, relationships, intuition, and how you give and receive care. At this rank, it marks dedication, focused work, sustained effort in this suit’s domain. Picture Traveler climbs away from stacked cups under moonlit sky and distant mountains—this subtly colors how this suit's lesson shows up here. *Archetype: Water Movement. Key symbols: eight engraved cups (momentum, departure, or quick progress), figure in action or exiting scene (choice to move toward alignment), lush riverbanks with lotus and reflective pools (landscape stretching toward next phase).* Treat it as a snapshot, not a sentence—a view of what’s here so you can choose how to meet it. Like riverbanks shaping the flow, these elements guide and contain each other constructively.\n\nBalancing this friction, we find— Future — trajectory if nothing shifts: Looking ahead, The Sun Reversed outlines a likely path of momentum. If things continue as they are, this shows how the trajectory leans toward inner child, feeling down, overly optimistic. On a symbolic level, some readers link this card to The Sun, radiating vitality, clarity, and conscious joy; treat that as color, not a command.  On a symbolic level, some readers link this card to The Sun, radiating vitality, clarity, and conscious joy and Path Resh (Hod ↔ Yesod), illuminating clarity that animates the self; treat that as color, not a command. The light feels too bright or not quite reaching; reconnect with simple pleasures to restore vitality. *Archetype: Joyful Illuminator / Vital Force. Key symbols: radiant sun with face (vitality, clarity), naked child (innocence, joy), sunflowers (happiness, growth).* Hold it as a forecast of trajectory, adjustable through your choices. Water and flame struggle for dominance; integration requires honoring both emotional depth and passionate drive.\n\nThe story unfolds from The Hermit through Eight of Cups to The Sun. The transition from first to second position is harmonious. Reaching the third position will require navigating dynamic tension.\n\n### Your Reflections\n\nThis reflection shows how this reading lands in your lived experience.\n\nQuiero sentirme presente sin perder mi rumbo.\n\nYour intuitive impressions are valid and add personal meaning to this reading.\n\n**The Overall Shape:** A call to pause, reflect, and integrate before acting\n**The Pivot:** Eight of Cups in Present — where you stand now. The Present is your point of power—where awareness becomes choice.\n**Recurring Themes:**\n- High Major Arcana presence suggests significant life themes at play, not just day-to-day concerns.\n\n**Emotional Journey:** The emotional tone remains relatively steady, centered around hope.\n\n**Guidance:** The answers you seek are within; create space to listen.\n\n*Remember: these cards illuminate, they don't determine. Your choices shape what unfolds.*\n\n### Moving Forward\n\nPace: Expect this to unfold across a meaningful chapter rather than in a single moment.\n\nThe path ahead shows The Sun Reversed. Within the Context-Dependent lens, Read each reversal according to what makes most sense for that specific card and position. This is not fixed fate, but the trajectory of current momentum. Your awareness and choices shape what comes next. The Future position carries a weight of 0.90, so its voice leads the guidance.\n\nAltogether, these threads suggest your next supportive step and point toward how to walk this path with agency.\n\nFor you this reads as a honest acknowledgment, inviting energy in motion.\n\n*Reversal lens reminder: Within the Context-Dependent lens, Read each reversal according to what makes most sense for that specific card and position.*",
      "themesSummary": {
        "reversalFramework": "contextual",
        "suitFocus": null,
        "archetypeDescription": "High Major Arcana presence indicates profound, soul-level themes, karmic patterns, and significant life transitions."
      }
    }
  ]
}